<?xml version="1.0" encoding="UTF-8"?>
<additional_belongings xmlns:xsi="http://www.w3.org/2001/XMLSchema-instance"
	xsi:noNamespaceSchemaLocation="../../validation/additional-belongings.xsd">
	<name>test_additional_belongings</name>
	<belongings_table>
		<belongings_row>
			<lower_limit>1</lower_limit>
			<belongings>
				<money>
					<name>test_money</name>
					<libra>11</libra>
					<denarii>22</denarii>
				</money>
				<has_to_choose>false</has_to_choose>
			</belongings>
		</belongings_row>
		<belongings_row>
			<lower_limit>5</lower_limit>
			<belongings>
				<reroll>
					<reroll_table>table_1</reroll_table>
					<rerolls>
						<reroll>1d6</reroll>
						<reroll>1d20+1</reroll>
					</rerolls>
				</reroll>
				<has_to_choose>false</has_to_choose>
			</belongings>
		</belongings_row>
		<belongings_row>
			<lower_limit>7</lower_limit>
			<belongings>
				<horses>
					<horse>horse_1</horse>
					<horse>horse_2</horse>
				</horses>
				<has_to_choose>true</has_to_choose>
			</belongings>
		</belongings_row>
		<belongings_row>
			<lower_limit>10</lower_limit>
			<belongings>
				<items>
					<item>item_1</item>
					<item>item_2</item>
				</items>
				<has_to_choose>false</has_to_choose>
			</belongings>
		</belongings_row>
		<belongings_row>
			<lower_limit>12</lower_limit>
			<belongings>
				<shields>
					<shield>shield_1</shield>
					<shield>shield_2</shield>
				</shields>
				<has_to_choose>false</has_to_choose>
			</belongings>
		</belongings_row>
		<belongings_row>
			<lower_limit>13</lower_limit>
			<belongings>
				<weapons>
					<weapon>weapon_1</weapon>
					<weapon>weapon_2</weapon>
				</weapons>
				<has_to_choose>false</has_to_choose>
			</belongings>
		</belongings_row>
		<belongings_row>
			<lower_limit>15</lower_limit>
			<belongings>
				<pets>
					<pet>pet_1</pet>
					<pet>pet_2</pet>
				</pets>
				<has_to_choose>false</has_to_choose>
			</belongings>
		</belongings_row>
	</belongings_table>
</additional_belongings>